{
  "classification": "D1",
  "contour": "governance",
  "integrity": {
    "parent_refs": [
      "environment:macos-colima-linux-amd64-emulated:2026-07-20",
      "git:974a5dd932e53b82407a4b71f8af5e5641803564",
      "probe:ai-off-core-operational",
      "probe:canonical-live-authority-absent",
      "probe:consciousness-authority-claim-absent",
      "probe:expired-proof-stale",
      "probe:ipc-role-spoof-denied",
      "probe:manifest-orphan-unbounded-cycle-denied",
      "probe:mixed-head-stale",
      "probe:parser-hostile-pack",
      "probe:pulse-stale-proof-no-green",
      "probe:pulse-zero-write",
      "probe:shadow-admission-parked",
      "probe:wait-authority-restart",
      "probe:writer-spoof-denied",
      "test:tests.test_s10_durable_feedback_capability",
      "test:tests.test_s11_manifest_topology",
      "test:tests.test_s12_state_pulse"
    ],
    "payload_sha256": "34527386082d32faefec6449a96c9faf97230ca83d30d9fbdbbecd14db136b4f",
    "profile_id": "core-json-sha256-v1"
  },
  "issued_at": "2026-07-20T08:15:00Z",
  "issuer": "independent-assurance-issuer",
  "object_id": "capability-proof:34527386082d32faefec6449a96c9faf97230ca83d30d9fbdbbecd14db136b4f",
  "payload": {
    "capability_id": "OPERATIONAL_SELF_MODEL",
    "code_sha256": "89fda8c02b0e22c7a9d2a7588bad298ad204b24ddfed1780af9e827f64d998c4",
    "compatibility_dependencies": [
      "python:>=3.11",
      "git:required",
      "make:required",
      "sqlite:WAL-single-writer",
      "environment-profile:52f5d7c8715b3027164a2b284ca912357fd2b8f4bf6f2f2ab356e032370d50e7"
    ],
    "config_sha256": "31233c747a7fc057ab48df47abe9845dc7edece5498a16c68b82e6fc96d3461d",
    "critical_dependencies": [
      "catalog:core:13bdac3a60227826550771635d7367854a8a5477240ed06b2c31198dbd6f5c50",
      "catalog:a1:eab6401e6fc1460433a7b45b052c0218f3d26a90e6489a234bf2d51d2269dbe1",
      "integration:s11-manifest-topology+s12-state-pulse"
    ],
    "data_refs": [
      "fixture:public-synthetic-organism-topology",
      "fixture:durable-offline-ledger-replay",
      "fixture:versioned-read-only-pulse-policy"
    ],
    "environment_compatibility_ref": "environment:macos-colima-linux-amd64-emulated:2026-07-20",
    "environment_ref": "environment:macos-colima-linux-amd64-emulated:2026-07-20",
    "evaluator_ref": "validator:operational-self-model-frozen-scope-v1",
    "executor_ref": "projector:organism-manifest-state-pulse:829eb5b9a6523cf782779df1172e9201d7409d8f16af89b011e0fb9467aafad9",
    "grants_authority": false,
    "invalidation_conditions": [
      "code-hash-drift",
      "config-hash-drift",
      "environment-compatibility-drift",
      "negative-probe-regression",
      "policy-hash-drift",
      "proof-expiry",
      "schema-hash-drift",
      "subject-head-drift"
    ],
    "issuer_independence": {
      "independent_of_executor": true,
      "independent_of_subject": true,
      "issuer_ref": "assurance-role:agent-5"
    },
    "negative_probe_refs": [
      "probe:ai-off-core-operational",
      "probe:canonical-live-authority-absent",
      "probe:consciousness-authority-claim-absent",
      "probe:expired-proof-stale",
      "probe:ipc-role-spoof-denied",
      "probe:manifest-orphan-unbounded-cycle-denied",
      "probe:mixed-head-stale",
      "probe:parser-hostile-pack",
      "probe:pulse-stale-proof-no-green",
      "probe:pulse-zero-write",
      "probe:shadow-admission-parked",
      "probe:wait-authority-restart",
      "probe:writer-spoof-denied"
    ],
    "policy_sha256": "00a24ffe76a6f48aa5a5bc523ed271f8f0c2da536c64e1aa4e482a235f619f8d",
    "proof_basis": [
      {
        "ci_run": 29651378496,
        "integration_ref": "integration:integration-s11-manifest-topology-20260718"
      },
      {
        "ci_run": 29651825920,
        "integration_ref": "integration:integration-s12-state-pulse-20260718"
      },
      {
        "acceptance": "AC-ORGANISM",
        "result": "green-for-frozen-offline-scope"
      },
      {
        "full_suite": {
          "core": 585,
          "stage0b": 25
        },
        "result": "green"
      },
      {
        "claim_scope": "EXACT_IMAGE_ACCEPTED_LEDGER_PULSE_ZERO_WRITE",
        "honest_state": "GENERATING_RUNNABLE_1_RED_STALE",
        "pulse_report_sha256": "fdd47085235750d6ff45aa790ee55074de72963d15161584739f96955169af9a"
      }
    ],
    "receipt_id": "capability-proof:f09-e1c-operational-self-model:974a5dd",
    "schema_sha256": "d262099ef5993d9064717ac03ca58eb5d1c393cf69161746b96017a67470e379",
    "scope": {
      "canonical_mutation": "DENIED",
      "data_scope": "D0_PUBLIC_SYNTHETIC_ONLY",
      "domain_application": "SHADOW_UNAPPLIED",
      "environments": [
        "linux-ci",
        "macos-development"
      ],
      "live_security_execution": "DENIED",
      "live_trading": "DENIED",
      "model_route": "NO_REAL_PROVIDER_REQUIRED",
      "proof_state": "OPERATIONAL_SELF_MODEL_PASS_WITH_DURABLE_OFFLINE_FIXTURES",
      "real_provider": "UNPROVEN"
    },
    "status": "PASS_FOR_FROZEN_SCOPE",
    "subject_ref": "git:974a5dd932e53b82407a4b71f8af5e5641803564",
    "test_refs": [
      "test:tests.test_s11_manifest_topology",
      "test:tests.test_s12_state_pulse",
      "test:tests.test_s10_durable_feedback_capability"
    ],
    "valid_from": "2026-07-20T08:15:00Z",
    "valid_until": "2026-08-19T08:15:00Z"
  },
  "schema_id": "CapabilityProofReceipt",
  "schema_version": "1.0.0"
}
