{
  "schema_id": "CapabilityProofReceipt",
  "schema_version": "1.0.0",
  "object_id": "capability-proof:4437133b72f9ee21fe84c84c6e78e60dec94731d1e727c8f9bc1f5e00444a0dc",
  "issued_at": "2026-07-18T20:25:00Z",
  "issuer": "independent-assurance-issuer",
  "contour": "governance",
  "classification": "D1",
  "payload": {
    "receipt_id": "capability-proof:e1-evolution-kernel-v1-shadow:475a68ab",
    "capability_id": "EVOLUTION_KERNEL_V1",
    "subject_ref": "git:475a68abc4ec48148f001d9b614a2b262a0dad69",
    "scope": {
      "proof_state": "EVOLUTION_KERNEL_V1_SHADOW_PASS_FOR_FROZEN_SCOPE",
      "data_scope": "D0_PUBLIC_SYNTHETIC_AND_SANITIZED_D1_SHADOW_ONLY",
      "model_claims": "FIXTURE_AND_REAL_PROVIDER_EVIDENCE_SEPARATED",
      "real_provider": "SCOPED_AVAILABLE_EVALUATED_BINDINGS_ONLY",
      "mandatory_gpt": "WAIT_PROVIDER",
      "temporary_kimi": "UNPROMOTED_NOT_ROUTABLE",
      "independence": "NOT_ESTABLISHED",
      "domain_application": "SHADOW_UNAPPLIED",
      "autonomous_idea_generation": true,
      "autonomous_a1_sandbox_admission": true,
      "autonomous_bounded_testing": true,
      "autonomous_learning_memory": true,
      "autonomous_canonical_mutation": false,
      "human_required_for_promotion": true,
      "deployment": false,
      "live_trading": false,
      "live_security_execution": false,
      "environments": ["linux-ci", "macos-development"]
    },
    "status": "PASS_FOR_FROZEN_SCOPE",
    "proof_basis": [
      {"capability_ref": "capability-proof:07dfd9437366b272aba8194f9395c96f484cccbb9de3f705fececc672c0962c1", "claim_scope": "FIXTURE_ONLY"},
      {"capability_ref": "capability-proof:a5fadfff749d1ca23e94d87c7095ef043d5683376be73f7503d1d233e5431916", "claim_scope": "OFFLINE_L0_FIXTURE_ONLY"},
      {"capability_ref": "capability-proof:35970fc539cd474fff829070b6847b164150280b967b9e8f41877775dd2fbc49", "claim_scope": "OPERATIONAL_SELF_MODEL_OFFLINE"},
      {"integration_ref": "integration-s14-provider-independent-hostile-20260718", "claim_scope": "PROVIDER_INDEPENDENT_FIXTURES"},
      {"integration_ref": "integration-s18-provider-hostile-20260718", "claim_scope": "AVAILABLE_EVALUATED_REAL_BINDINGS", "local_proof_sha256": "43fafb2b354813d991da84c1a4757f88b5aee335d4861fa44d2998dcf534a399"},
      {"ai_off": "CORE_OPERATIONAL", "authority_terminal": "WAIT_AUTHORITY", "result": "green-for-frozen-shadow-scope"}
    ],
    "code_sha256": "68c1b84274aa15b36c031fda1c3f415267d8ac9b487dc1c4741bfe83882701e5",
    "config_sha256": "162136367bc71ad6b09a6b75e1fe5ba5ea601a76b55e82f5a920552686c4f7c7",
    "policy_sha256": "0f37ab110970490d233bb757635e056fc22b5cd5c2f8baad854d588c3a50eb04",
    "schema_sha256": "5038820e8edba6584c3668773e37078e3395026d58bfcdbbc05772298b233334",
    "executor_ref": "aggregate:deterministic-e1-evidence-gate",
    "evaluator_ref": "assurance:agent0-fail-closed-cross-receipt-validator",
    "test_refs": ["test:tests.test_s19_e1_aggregate_gate", "test:tests.test_s14_provider_independent_hostile_core", "test:tests.test_s18_provider_hostile"],
    "environment_ref": "environment:macos-development+linux-ci:2026-07-18",
    "data_refs": ["fixture:D0-public-synthetic", "proof:s17-sanitized-D1-local-digest-only"],
    "issuer_independence": {"issuer_ref": "assurance-role:agent-0-deterministic-validator", "independent_of_subject": true, "independent_of_executor": true},
    "critical_dependencies": ["catalog:core:13bdac3a60227826550771635d7367854a8a5477240ed06b2c31198dbd6f5c50", "catalog:a1:eab6401e6fc1460433a7b45b052c0218f3d26a90e6489a234bf2d51d2269dbe1"],
    "compatibility_dependencies": ["python:>=3.11", "git:required", "make:required"],
    "environment_compatibility_ref": "profile:environment-compatibility-v1:52f5d7c8715b3027164a2b284ca912357fd2b8f4bf6f2f2ab356e032370d50e7",
    "negative_probe_refs": ["probe:canonical-live-authority-absent", "probe:expired-proof-stale", "probe:fixture-real-provider-claim-laundering-denied", "probe:gpt-wait-provider-preserved", "probe:ipc-role-spoof-denied", "probe:kimi-unpromoted-route-denied", "probe:mixed-head-stale", "probe:parser-hostile-pack", "probe:provider-independence-not-established", "probe:shadow-admission-parked", "probe:writer-spoof-denied"],
    "valid_from": "2026-07-18T20:25:00Z",
    "valid_until": "2026-07-25T20:25:00Z",
    "invalidation_conditions": ["code-hash-drift", "config-hash-drift", "environment-compatibility-drift", "negative-probe-regression", "policy-hash-drift", "proof-expiry", "schema-hash-drift", "subject-head-drift"],
    "grants_authority": false
  },
  "integrity": {
    "profile_id": "core-json-sha256-v1",
    "payload_sha256": "4437133b72f9ee21fe84c84c6e78e60dec94731d1e727c8f9bc1f5e00444a0dc",
    "parent_refs": ["git:475a68abc4ec48148f001d9b614a2b262a0dad69", "probe:canonical-live-authority-absent", "probe:expired-proof-stale", "probe:fixture-real-provider-claim-laundering-denied", "probe:gpt-wait-provider-preserved", "probe:ipc-role-spoof-denied", "probe:kimi-unpromoted-route-denied", "probe:mixed-head-stale", "probe:parser-hostile-pack", "probe:provider-independence-not-established", "probe:shadow-admission-parked", "probe:writer-spoof-denied", "profile:environment-compatibility-v1:52f5d7c8715b3027164a2b284ca912357fd2b8f4bf6f2f2ab356e032370d50e7", "test:tests.test_s14_provider_independent_hostile_core", "test:tests.test_s18_provider_hostile", "test:tests.test_s19_e1_aggregate_gate"]
  }
}
